{
  "schema_version": "t023.semantic.analysis.v1",
  "job_id": "job-023-001",
  "attempt_id": "attempt-1",
  "provider_type": "model",
  "primary_region_id": "region-person-1",
  "created_at": "2026-06-23T00:00:00Z",
  "regions": [
    {
      "region_id": "region-person-1",
      "region_type": "person",
      "priority": 1,
      "confidence": 0.96,
      "attributes": {
        "portrait": true
      },
      "quality_risks": [
        "face_highlight"
      ],
      "recommended_intents": [
        "protect_face_highlights",
        "natural_skin_tone"
      ],
      "source": "model-normalized"
    },
    {
      "region_id": "region-sky-1",
      "region_type": "sky",
      "priority": 2,
      "confidence": 0.91,
      "attributes": {
        "coverage": 0.32
      },
      "quality_risks": [
        "over_saturation"
      ],
      "recommended_intents": [
        "preserve_sky_detail"
      ],
      "source": "model-normalized"
    }
  ]
}
